{
  "schema": "local-seo-brain.knowledge-overlays.v1",
  "as_of": "2026-10-15",
  "defaults": {
    "status": "active",
    "tags": [
      "domain/local-seo"
    ]
  },
  "notes": {
    "wiki/audits/content-audit-homepage.md": {
      "claim_ids": [
        "operator-evidence-review"
      ],
      "assessment": "provisional",
      "confidence": "PRACTITIONER",
      "verified_at": "2026-10-15",
      "refresh_due": "2026-11-14",
      "mode": "replace",
      "callouts": [],
      "replacement_body": "## Working guidance\n\nCompare the homepage’s stated services, service area, contact details, and next action with owner-confirmed facts. Record contradictions and missing proof before drafting repairs.\n\n## Use this note\n\nInputs: The current homepage, its intended customer task, and owner-confirmed services, service area, and contact details.\n\nResult: Passage-level findings with factual contradictions, missing proof, and a proposed repair for owner review."
    },
    "wiki/audits/content-audit-overview.md": {
      "claim_ids": [
        "operator-evidence-review"
      ],
      "assessment": "provisional",
      "confidence": "PRACTITIONER",
      "verified_at": "2026-10-15",
      "refresh_due": "2026-11-14",
      "mode": "replace",
      "callouts": [],
      "replacement_body": "## Working guidance\n\nInventory existing pages and their intended user tasks. Identify duplication, unsupported claims, and gaps against supplied business evidence.\n\n## Use this note\n\nInputs: A dated page inventory, page purposes, business priorities, and the evidence available for each page.\n\nResult: An audit map identifying overlap, unsupported claims, evidence gaps, and the appropriate page-level review."
    },
    "wiki/audits/content-audit-supporting-pages.md": {
      "claim_ids": [
        "operator-evidence-review"
      ],
      "assessment": "provisional",
      "confidence": "PRACTITIONER",
      "verified_at": "2026-10-15",
      "refresh_due": "2026-11-14",
      "mode": "replace",
      "callouts": [],
      "replacement_body": "## Working guidance\n\nCheck whether each supporting page answers a distinct customer question and links to the relevant service. Remove conclusions that the supplied source does not support.\n\n## Use this note\n\nInputs: The supporting-page inventory, customer questions, page drafts, and the relevant service pages.\n\nResult: A page/question/service map with gaps, duplication, and specific consolidation or revision proposals."
    },
    "wiki/audits/content-planning-geographical-relevance-part-1.md": {
      "claim_ids": [
        "no-universal-content-formula",
        "operator-evidence-review"
      ],
      "assessment": "provisional",
      "confidence": "PRACTITIONER",
      "verified_at": "2026-10-15",
      "refresh_due": "2026-11-14",
      "mode": "replace",
      "callouts": [],
      "replacement_body": "## Working guidance\n\nUse the confirmed service area and observed customer questions to propose location-page candidates. Treat unverified place names and demand as needs_input.\n\n## Use this note\n\nInputs: The confirmed service area, actual customer questions, and existing location-page inventory.\n\nResult: Location-page candidates with the distinct customer task, available local evidence, and unresolved facts.\n\n## Evidence and limits\n\nGoogle documents no preferred universal word count, keyword density, publication cadence, or fixed page-count framework; content should be people-first and useful for its purpose. (Claim: no-universal-content-formula; sources: google-helpful-content, google-seo-starter-guide.)"
    },
    "wiki/audits/content-planning-geographical-relevance-part-2.md": {
      "claim_ids": [
        "no-universal-content-formula",
        "operator-evidence-review"
      ],
      "assessment": "provisional",
      "confidence": "PRACTITIONER",
      "verified_at": "2026-10-15",
      "refresh_due": "2026-11-14",
      "mode": "replace",
      "callouts": [],
      "replacement_body": "## Working guidance\n\nReview each proposed location page for distinct business evidence and user value. Consolidate candidates that merely repeat the same service text with a changed place name.\n\n## Use this note\n\nInputs: Candidate location pages and the business records supporting their claimed local differences.\n\nResult: Keep, consolidate, or needs_input decisions for each candidate, with the supporting evidence.\n\n## Evidence and limits\n\nGoogle documents no preferred universal word count, keyword density, publication cadence, or fixed page-count framework; content should be people-first and useful for its purpose. (Claim: no-universal-content-formula; sources: google-helpful-content, google-seo-starter-guide.)"
    },
    "wiki/audits/content-planning-topical-relevance-part-1.md": {
      "claim_ids": [
        "no-universal-content-formula",
        "operator-evidence-review"
      ],
      "assessment": "provisional",
      "confidence": "PRACTITIONER",
      "verified_at": "2026-10-15",
      "refresh_due": "2026-11-14",
      "mode": "replace",
      "callouts": [],
      "replacement_body": "## Working guidance\n\nGroup supplied search queries and customer questions by the task they express. Draft page purposes without inventing search volume or conversion potential.\n\n## Use this note\n\nInputs: Observed queries and customer questions, with their source, locale, date, and relevant business offering.\n\nResult: Task-based topic groups and proposed page purposes, keeping unmeasured demand and competition unknown.\n\n## Evidence and limits\n\nGoogle documents no preferred universal word count, keyword density, publication cadence, or fixed page-count framework; content should be people-first and useful for its purpose. (Claim: no-universal-content-formula; sources: google-helpful-content, google-seo-starter-guide.)"
    },
    "wiki/audits/content-planning-topical-relevance-part-2.md": {
      "claim_ids": [
        "no-universal-content-formula",
        "operator-evidence-review"
      ],
      "assessment": "provisional",
      "confidence": "PRACTITIONER",
      "verified_at": "2026-10-15",
      "refresh_due": "2026-11-14",
      "mode": "replace",
      "callouts": [],
      "replacement_body": "## Working guidance\n\nMap topic groups to existing pages. Add a page only when a distinct useful answer and supporting facts exist.\n\n## Use this note\n\nInputs: The topic groups, existing URL inventory, and evidence supporting each proposed answer.\n\nResult: An existing-page/new-page map, duplication decisions, evidence gaps, and useful internal navigation.\n\n## Evidence and limits\n\nGoogle documents no preferred universal word count, keyword density, publication cadence, or fixed page-count framework; content should be people-first and useful for its purpose. (Claim: no-universal-content-formula; sources: google-helpful-content, google-seo-starter-guide.)"
    },
    "wiki/audits/e-e-a-t-with-about-us-page.md": {
      "claim_ids": [
        "eeat-trust-context",
        "operator-evidence-review"
      ],
      "assessment": "provisional",
      "confidence": "PRACTITIONER",
      "verified_at": "2026-10-15",
      "refresh_due": "2026-11-14",
      "mode": "replace",
      "callouts": [],
      "replacement_body": "## Working guidance\n\nCheck the About page against supplied identity, qualifications, contact information, and experience records. Request evidence for claims instead of inventing a biography or treating author markup as a ranking lever.\n\n## Use this note\n\nInputs: The About page and verified identity, qualifications, experience, and contact records.\n\nResult: Supported revisions and proof requests, with unsupported credentials or experience claims flagged.\n\n## Evidence and limits\n\nGoogle describes E-E-A-T as a quality-assessment concept, not a specific ranking factor. Accurate authorship, sourcing, and demonstrated experience can help readers assess trust. (Claim: eeat-trust-context; sources: google-helpful-content.)"
    },
    "wiki/audits/property-audit-part-1.md": {
      "claim_ids": [
        "operator-evidence-review"
      ],
      "assessment": "provisional",
      "confidence": "PRACTITIONER",
      "verified_at": "2026-10-15",
      "refresh_due": "2026-11-14",
      "mode": "replace",
      "callouts": [],
      "replacement_body": "## Working guidance\n\nConfirm business identity, location model, account ownership, and website inventory using authorized records before evaluating recommendations.\n\n## Use this note\n\nInputs: Owner-authorized identity and ownership records, the location model, and the website inventory.\n\nResult: A confirmed scope and access record, contradictions to resolve, and the evidence needed before the audit proceeds."
    },
    "wiki/audits/property-audit-part-2.md": {
      "claim_ids": [
        "operator-evidence-review"
      ],
      "assessment": "provisional",
      "confidence": "PRACTITIONER",
      "verified_at": "2026-10-15",
      "refresh_due": "2026-11-14",
      "mode": "replace",
      "callouts": [],
      "replacement_body": "## Working guidance\n\nReview supplied crawl, index, content, link, and measurement evidence. Separate observed problems from possible causes and unmeasured effects.\n\n## Use this note\n\nInputs: Dated crawl, index, page, link, and measurement exports for the agreed property scope.\n\nResult: Observed issues with exact source locators, separate hypotheses, and the next check needed to test each hypothesis."
    },
    "wiki/audits/property-audit-quick-wins.md": {
      "claim_ids": [
        "operator-evidence-review"
      ],
      "assessment": "provisional",
      "confidence": "PRACTITIONER",
      "verified_at": "2026-10-15",
      "refresh_due": "2026-11-14",
      "mode": "replace",
      "callouts": [],